[
  {
    "poi_id": "HOSP_BJ_0001",
    "name": "北京大学第一医院",
    "poi_type": "hospital",
    "city": "北京市",
    "address": "北京市西城区西什库大街8号",
    "coordinates": {
      "longitude": 116.3723,
      "latitude": 39.9342,
      "coordinate_system": "GCJ02"
    },
    "phone": "010-83572211",
    "postcode": "100034"
  },
  {
    "poi_id": "HOSP_BJ_0002",
    "name": "北京协和医院",
    "poi_type": "hospital",
    "city": "北京市",
    "address": "北京市东城区王府井大街1号",
    "coordinates": {
      "longitude": 116.4057,
      "latitude": 39.9175,
      "coordinate_system": "GCJ02"
    },
    "phone": "010-65295239",
    "postcode": "100730"
  },
  {
    "poi_id": "HOSP_SH_0001",
    "name": "复旦大学附属中山医院",
    "poi_type": "hospital",
    "city": "上海市",
    "address": "上海市徐汇区斜土路1609号",
    "coordinates": {
      "longitude": 121.4457,
      "latitude": 31.1917,
      "coordinate_system": "GCJ02"
    },
    "phone": "021-64041990",
    "postcode": "200032"
  },
  {
    "poi_id": "HOSP_GZ_0001",
    "name": "广州市第一人民医院",
    "poi_type": "hospital",
    "city": "广州市",
    "address": "广州市越秀区党校前街1号",
    "coordinates": {
      "longitude": 113.2759,
      "latitude": 23.1291,
      "coordinate_system": "GCJ02"
    },
    "phone": "020-81048888",
    "postcode": "510080"
  },
  {
    "poi_id": "HOSP_SZ_0001",
    "name": "深圳市人民医院",
    "poi_type": "hospital",
    "city": "深圳市",
    "address": "深圳市罗湖区东门北路1017号",
    "coordinates": {
      "longitude": 114.1317,
      "latitude": 22.5463,
      "coordinate_system": "GCJ02"
    },
    "phone": "0755-25533018",
    "postcode": "518020"
  },
  {
    "poi_id": "GOVT_BJ_0001",
    "name": "北京市人民政府",
    "poi_type": "government",
    "city": "北京市",
    "address": "北京市东城区宣武门内大街45号",
    "coordinates": {
      "longitude": 116.3974,
      "latitude": 39.8915,
      "coordinate_system": "GCJ02"
    }
  },
  {
    "poi_id": "GOVT_SH_0001",
    "name": "上海市人民政府",
    "poi_type": "government",
    "city": "上海市",
    "address": "上海市黄浦区人民大道200号",
    "coordinates": {
      "longitude": 121.4895,
      "latitude": 31.2304,
      "coordinate_system": "GCJ02"
    }
  },
  {
    "poi_id": "GOVT_GZ_0001",
    "name": "广州市人民政府",
    "poi_type": "government",
    "city": "广州市",
    "address": "广州市越秀区越华路115号",
    "coordinates": {
      "longitude": 113.2644,
      "latitude": 23.1291,
      "coordinate_system": "GCJ02"
    }
  },
  {
    "poi_id": "GOVT_CQ_0001",
    "name": "重庆市人民政府",
    "poi_type": "government",
    "city": "重庆市",
    "address": "重庆市渝中区人民路1号",
    "coordinates": {
      "longitude": 106.5516,
      "latitude": 29.5630,
      "coordinate_system": "GCJ02"
    }
  },
  {
    "poi_id": "GOVT_CD_0001",
    "name": "成都市人民政府",
    "poi_type": "government",
    "city": "成都市",
    "address": "成都市武侯区一环路西一段109号",
    "coordinates": {
      "longitude": 104.0659,
      "latitude": 30.5728,
      "coordinate_system": "GCJ02"
    }
  },
  {
    "poi_id": "POLI_BJ_0001",
    "name": "北京市公安局",
    "poi_type": "police",
    "city": "北京市",
    "address": "北京市西城区骡马市大街1号",
    "coordinates": {
      "longitude": 116.3769,
      "latitude": 39.9054,
      "coordinate_system": "GCJ02"
    },
    "phone": "010-86237474"
  },
  {
    "poi_id": "POLI_SH_0001",
    "name": "上海市公安局",
    "poi_type": "police",
    "city": "上海市",
    "address": "上海市静安区恒丰路658号",
    "coordinates": {
      "longitude": 121.4450,
      "latitude": 31.2533,
      "coordinate_system": "GCJ02"
    }
  },
  {
    "poi_id": "POLI_GZ_0001",
    "name": "广州市公安局",
    "poi_type": "police",
    "city": "广州市",
    "address": "广州市越秀区越华路112号",
    "coordinates": {
      "longitude": 113.2644,
      "latitude": 23.1291,
      "coordinate_system": "GCJ02"
    }
  },
  {
    "poi_id": "POLI_XA_0001",
    "name": "西安市公安局",
    "poi_type": "police",
    "city": "西安市",
    "address": "西安市莲湖区北关正街187号",
    "coordinates": {
      "longitude": 108.9398,
      "latitude": 34.3416,
      "coordinate_system": "GCJ02"
    }
  },
  {
    "poi_id": "POLI_WH_0001",
    "name": "武汉市公安局",
    "poi_type": "police",
    "city": "武汉市",
    "address": "武汉市汉口区中山大道1号",
    "coordinates": {
      "longitude": 114.3055,
      "latitude": 30.5928,
      "coordinate_system": "GCJ02"
    }
  },
  {
    "poi_id": "COURT_BJ_0001",
    "name": "北京市高级人民法院",
    "poi_type": "court",
    "city": "北京市",
    "address": "北京市东城区朝阳门内大街96号",
    "coordinates": {
      "longitude": 116.4200,
      "latitude": 39.9109,
      "coordinate_system": "GCJ02"
    },
    "phone": "010-84036000"
  },
  {
    "poi_id": "COURT_SH_0001",
    "name": "上海市高级人民法院",
    "poi_type": "court",
    "city": "上海市",
    "address": "上海市浦东新区世纪大道1600号",
    "coordinates": {
      "longitude": 121.4950,
      "latitude": 31.2387,
      "coordinate_system": "GCJ02"
    }
  },
  {
    "poi_id": "COURT_GZ_0001",
    "name": "广州市中级人民法院",
    "poi_type": "court",
    "city": "广州市",
    "address": "广州市越秀区中山六路87号",
    "coordinates": {
      "longitude": 113.2566,
      "latitude": 23.1291,
      "coordinate_system": "GCJ02"
    }
  },
  {
    "poi_id": "COURT_SZ_0001",
    "name": "深圳市中级人民法院",
    "poi_type": "court",
    "city": "深圳市",
    "address": "深圳市福田区莲花山脚庆云路888号",
    "coordinates": {
      "longitude": 114.0895,
      "latitude": 22.5417,
      "coordinate_system": "GCJ02"
    }
  },
  {
    "poi_id": "COURT_NJ_0001",
    "name": "南京市中级人民法院",
    "poi_type": "court",
    "city": "南京市",
    "address": "南京市秦淮区建邺路228号",
    "coordinates": {
      "longitude": 118.7969,
      "latitude": 32.0603,
      "coordinate_system": "GCJ02"
    }
  },
  {
    "poi_id": "PROC_BJ_0001",
    "name": "北京市人民检察院",
    "poi_type": "procuratorate",
    "city": "北京市",
    "address": "北京市西城区长椿街8号",
    "coordinates": {
      "longitude": 116.3621,
      "latitude": 39.9247,
      "coordinate_system": "GCJ02"
    },
    "phone": "010-66253380"
  },
  {
    "poi_id": "PROC_SH_0001",
    "name": "上海市人民检察院",
    "poi_type": "procuratorate",
    "city": "上海市",
    "address": "上海市静安区昌平路600号",
    "coordinates": {
      "longitude": 121.4524,
      "latitude": 31.2596,
      "coordinate_system": "GCJ02"
    }
  },
  {
    "poi_id": "PROC_GZ_0001",
    "name": "广州市人民检察院",
    "poi_type": "procuratorate",
    "city": "广州市",
    "address": "广州市越秀区沿江中路181号",
    "coordinates": {
      "longitude": 113.2527,
      "latitude": 23.1291,
      "coordinate_system": "GCJ02"
    }
  },
  {
    "poi_id": "SCE_BJ_0001",
    "name": "故宫博物院5A景区",
    "poi_type": "scenic",
    "city": "北京市",
    "address": "北京市东城区景山前街4号",
    "coordinates": {
      "longitude": 116.3972,
      "latitude": 39.9238,
      "coordinate_system": "GCJ02"
    },
    "phone": "010-85007421",
    "postcode": "100009"
  },
  {
    "poi_id": "SCE_BJ_0002",
    "name": "天坛公园5A景区",
    "poi_type": "scenic",
    "city": "北京市",
    "address": "北京市东城区天坛路1号",
    "coordinates": {
      "longitude": 116.4131,
      "latitude": 39.8826,
      "coordinate_system": "GCJ02"
    }
  },
  {
    "poi_id": "SCE_HZ_0001",
    "name": "西湖5A景区",
    "poi_type": "scenic",
    "city": "杭州市",
    "address": "杭州市西湖区龙井路1号",
    "coordinates": {
      "longitude": 120.1551,
      "latitude": 30.2741,
      "coordinate_system": "GCJ02"
    },
    "phone": "0571-87067999"
  },
  {
    "poi_id": "SCE_GZ_0001",
    "name": "广州白云山5A景区",
    "poi_type": "scenic",
    "city": "广州市",
    "address": "广州市白云区广州大道北1961号",
    "coordinates": {
      "longitude": 113.2819,
      "latitude": 23.1617,
      "coordinate_system": "GCJ02"
    }
  },
  {
    "poi_id": "MUS_BJ_0001",
    "name": "中国国家博物馆",
    "poi_type": "museum",
    "city": "北京市",
    "address": "北京市东城区天安门广场东侧1号",
    "coordinates": {
      "longitude": 116.4074,
      "latitude": 39.9042,
      "coordinate_system": "GCJ02"
    },
    "phone": "010-65128901"
  },
  {
    "poi_id": "MUS_SH_0001",
    "name": "上海博物馆",
    "poi_type": "museum",
    "city": "上海市",
    "address": "上海市黄浦区人民大道201号",
    "coordinates": {
      "longitude": 121.4895,
      "latitude": 31.2304,
      "coordinate_system": "GCJ02"
    },
    "phone": "021-63723500"
  },
  {
    "poi_id": "MUS_GZ_0001",
    "name": "广州博物馆",
    "poi_type": "museum",
    "city": "广州市",
    "address": "广州市越秀区中山五路93号",
    "coordinates": {
      "longitude": 113.2566,
      "latitude": 23.1320,
      "coordinate_system": "GCJ02"
    }
  },
  {
    "poi_id": "MUS_NJ_0001",
    "name": "南京博物院",
    "poi_type": "museum",
    "city": "南京市",
    "address": "南京市玄武区中山东路321号",
    "coordinates": {
      "longitude": 118.8069,
      "latitude": 32.0603,
      "coordinate_system": "GCJ02"
    }
  },
  {
    "poi_id": "MUS_CD_0001",
    "name": "四川博物院",
    "poi_type": "museum",
    "city": "成都市",
    "address": "成都市浦江县浦江镇浦江街159号",
    "coordinates": {
      "longitude": 104.0659,
      "latitude": 30.5728,
      "coordinate_system": "GCJ02"
    }
  },
  {
    "poi_id": "UNIV_BJ_0001",
    "name": "北京大学",
    "poi_type": "university",
    "city": "北京市",
    "address": "北京市海淀区颐和园路5号",
    "coordinates": {
      "longitude": 116.3071,
      "latitude": 39.9993,
      "coordinate_system": "GCJ02"
    },
    "phone": "010-62751131"
  },
  {
    "poi_id": "UNIV_BJ_0002",
    "name": "清华大学",
    "poi_type": "university",
    "city": "北京市",
    "address": "北京市海淀区清华园1号",
    "coordinates": {
      "longitude": 116.3270,
      "latitude": 40.0084,
      "coordinate_system": "GCJ02"
    },
    "phone": "010-62793001"
  },
  {
    "poi_id": "UNIV_SH_0001",
    "name": "复旦大学",
    "poi_type": "university",
    "city": "上海市",
    "address": "上海市杨浦区邯郸路220号",
    "coordinates": {
      "longitude": 121.4947,
      "latitude": 31.2934,
      "coordinate_system": "GCJ02"
    },
    "phone": "021-65642222"
  },
  {
    "poi_id": "UNIV_HZ_0001",
    "name": "浙江大学",
    "poi_type": "university",
    "city": "杭州市",
    "address": "杭州市西湖区西溪路1号",
    "coordinates": {
      "longitude": 120.1551,
      "latitude": 30.2741,
      "coordinate_system": "GCJ02"
    },
    "phone": "0571-87951234"
  },
  {
    "poi_id": "UNIV_NJ_0001",
    "name": "南京大学",